Title,Topics,Story
The Lantern of Wishes,"Magic and Fairy Tales, Friendship and Adventure","
In a village nestled between misty mountains, there was a tale whispered among the townsfolk—a story of an ancient, magical lantern hidden deep within the enchanted forest. They called it the Lantern of Wishes, said to grant one wish to anyone with a heart pure enough to light its flame. But the forest was a maze of twisting paths and shimmering illusions, and no one who went searching ever found the lantern.
One autumn afternoon, two best friends—Mira and Kai—sat by the edge of the forest, watching the leaves swirl in the wind. Mira had always dreamed of adventures, while Kai preferred quiet days spent drawing pictures in his sketchbook. But today, Mira was buzzing with excitement.
“Let’s find the Lantern of Wishes!” Mira said, her eyes sparkling. “We could wish for anything!”
Kai frowned. “But what if we get lost? Or what if it’s just a story?”
Mira gave him a playful nudge. “Come on, Kai. Don’t you ever wonder what it would be like to find something magical?”
Kai hesitated, but he couldn’t resist Mira’s grin. “Okay,” he sighed. “But if we meet any enchanted bears, you have to do the talking.”

The two friends packed some snacks and a blanket, then slipped into the forest. Sunlight trickled through the trees, and the air smelled like pine and fallen leaves. They followed a winding path that twisted deeper into the woods, each step taking them further from the familiar world.
As they walked, strange things began to happen. Mossy stones glowed faintly, and the trees whispered softly in a language they couldn’t understand. Then, just ahead, they saw a fox with fur as white as snow sitting on the path. Its eyes shimmered like starlight.
“Are you lost?” the fox asked, tilting its head.
Mira’s heart skipped. “We’re looking for the Lantern of Wishes. Do you know where it is?”
The fox chuckled softly. “Many have searched for it. Few find it. But perhaps you are different.” It flicked its tail and turned toward a hidden trail. “Follow me.”
The fox led them through narrow, twisting paths, past trees with branches like silver and streams that glowed under the shadow of twilight. After a while, they reached a clearing where the sky was filled with countless fireflies, their tiny lights flickering like stars.
At the center of the clearing stood an old stone pedestal, and on top of it rested a lantern made of glass and gold. But there was no flame inside—only darkness.
“This is it,” Mira whispered, her heart racing. She reached out to touch the lantern, but the fox shook its head.

“The Lantern of Wishes only lights for those who understand what they truly wish for,” the fox said. “Think carefully. A selfish wish will leave the lantern dark.”
Mira and Kai exchanged a glance. “What do we wish for?” Kai asked.
Mira thought hard. “We could wish for treasure! Or to never have homework again!” But as soon as she said the words, the lantern remained dim and cold.
Kai sat down on the grass, thinking quietly. Then, at last, he said, “What if… we just wish to always be friends, no matter where our adventures take us?”
Mira blinked in surprise. “But… we don’t need a magic lantern for that.”
“Maybe not,” Kai said, “but it’s the most important wish I can think of.”
Mira smiled. “You’re right, Kai. Let’s do it.”
Together, they placed their hands on the lantern. “We wish to always stay friends,” they whispered in unison.

For a moment, nothing happened. Then, with a soft, warm glow, a tiny flame flickered to life inside the lantern. The glass glowed gold, and the fireflies in the clearing gathered around it, their lights swirling like dancing stars.
The fox smiled. “You have found the true magic of the Lantern of Wishes. It doesn’t grant things you can hold in your hands—it grants things that live in your heart.”
Mira and Kai stared in wonder as the flame grew brighter, filling them with a sense of peace and joy. “We did it,” Mira whispered, squeezing Kai’s hand.
The fox gave them a gentle nod. “The lantern’s magic will stay with you, even after you leave. Now, it is time to go home.”
The two friends walked back through the forest, the glow of the lantern lingering in their hearts. The path that had seemed so tangled before now felt easy and clear, as if the forest had opened itself to them.

When they reached the edge of the forest, the sun was setting, and the first stars were appearing in the sky. Mira turned to Kai with a grin. “See? I told you we’d find something magical.”
Kai laughed, and together they sat on the blanket, watching the stars come out one by one. The lantern might have stayed in the forest, but its magic—the kind that keeps friendships strong—would stay with them always.
And so, Mira and Kai never needed to make another wish. They had already found the most magical thing of all: a friendship that would last, no matter where their adventures took them.

The End. "
The Great Spaghetti Disaster,Family and Everyday Life,"
It was Dad’s turn to cook dinner—and whenever Dad cooked, it was an adventure. Sometimes that adventure meant pancakes for dinner or sandwiches stacked too tall to fit in anyone’s mouth. But tonight, Dad had declared it was going to be “a fancy meal.”
“We’re having spaghetti and meatballs!” Dad announced proudly, waving a wooden spoon like a magic wand.
“Yay!” cheered Amelia and her little brother Charlie. Spaghetti was their favorite—especially when it came with lots of sauce and a mountain of Parmesan cheese.
Their mom smiled from the kitchen doorway. “I’ll leave you three to it, then. I’ll be back soon—try not to burn the house down.”
“We’ve got this!” Dad said confidently, puffing out his chest. “How hard can spaghetti be?”
Amelia had her doubts, but she liked helping in the kitchen, and Charlie was excited to stir things. “We’re Dad’s Cooking Crew!” Amelia declared, tying an apron around Charlie, who was already wielding the spoon like a knight with a sword.
Dad read the instructions off the spaghetti box. “Alright, Amelia, you start the water boiling. Charlie, you can mix the meatballs.”
Charlie happily dumped too much breadcrumbs into the bowl. ""Oops!"" he giggled, sending a cloud of flour into the air.
“Perfect start!” Dad said, patting him on the back. “That’s the creativity we need!”
Things were going smoothly—at first. But then everything seemed to happen at once.

The water on the stove boiled over, hissing as it splashed onto the burner. Charlie, distracted by stirring too enthusiastically, sent one of the raw meatballs flying across the kitchen. It hit the floor with a wet splat.
“Catch it, catch it!” Amelia shouted, trying to grab it as it rolled under the fridge.
“Too late!” Dad declared dramatically. “That meatball belongs to the dust bunnies now.”
As Amelia tried to stop the pot from boiling over, Charlie dropped another egg on the floor, sending yellow goo everywhere. “Sorry!” Charlie squeaked, standing in a puddle of egg.
“It’s okay! We’ll just—whoa!” Dad tried to mop up the egg with a paper towel, but slipped, grabbing the counter for balance. His elbow knocked the spaghetti box, sending uncooked noodles flying all over the kitchen like confetti.
Amelia and Charlie burst into laughter. “It’s a spaghetti storm!” Amelia giggled.
Dad was laughing too now, sitting on the floor in the middle of a mess of noodles, egg, and a single lost meatball. “Okay,” he said between chuckles. “Maybe this is harder than it looks.”
Amelia wiped tears of laughter from her eyes. “What do we do now?”
“Well,” Dad said thoughtfully, standing up and brushing spaghetti off his shirt, “we’re problem solvers, right? So, let’s fix this.”
Charlie clapped his sticky hands together. “Yes! Let’s fix it!”

They cleaned up as best they could. Amelia scooped the remaining noodles off the floor while Dad managed to rescue the sauce that had nearly boiled over. Charlie was put in charge of “quality control” (which mostly meant snacking on stray meatballs).
Before long, the kitchen was back in some kind of order, and they got the meatballs frying on the stove while the noodles finally boiled without incident. The sauce bubbled, filling the kitchen with a rich, tomatoey smell.
When Mom came home, she sniffed the air. “Mmm, smells amazing! How’d it go?”
Dad gave her a sheepish grin. “Well… there were a few bumps along the way.”
Charlie held up a lone uncooked spaghetti strand they’d missed on the floor. “Like this!”
Mom laughed as Amelia and Dad shared the story of the flying meatball and the great spaghetti storm.
“Well, it looks like you pulled it off,” Mom said, giving them all a big hug. 
They all sat down at the table, and Dad proudly served the plates of spaghetti and meatballs. The sauce was a little too thick, the noodles a bit overcooked, and some of the meatballs were a little lopsided. But when Amelia and Charlie took their first bites, they grinned from ear to ear.
“This is the best spaghetti ever!” Charlie declared with his mouth full.
Amelia nodded in agreement. “Yeah! Way better than normal.”
Dad gave a mock bow. “Thank you, thank you. I call it Spaghetti Chaos à la Dad.”
Mom smiled warmly as she twirled noodles around her fork. “You know,” she said, “this might just be the start of a new family tradition.”
Amelia and Charlie looked at each other with excitement. “The Great Spaghetti Adventure!” they shouted together.
Dad laughed. “That’s right! And next time, maybe we’ll even keep all the meatballs on the counter.”
“Maybe,” Amelia said, grinning. “But where’s the fun in that?”

The End."
The Saturday Morning Market,Family and Everyday Life,"
Every Saturday morning, Sofia and her dad had a tradition. They woke up early, long before the rest of the town, and headed to the farmers’ market. It was their special time together—just Sofia, Dad, and the promise of fresh bread, sweet fruit, and little surprises along the way.
Sofia loved everything about the market. The colors, the smells, the sounds of vendors chatting and calling out to customers—it all felt like a tiny adventure.
As they walked toward the market, Sofia held her dad’s hand, her other hand gripping the small shopping list they had made the night before.
“So, what’s first on the list, assistant shopper?” Dad asked playfully.
Sofia unfolded the list. “Eggs,” she read aloud. “And then blueberries for pancakes.”
“Eggs and blueberries,” Dad repeated. “Perfect. Let’s get to work.”

At the egg stand, they met Mrs. Phelps, who had been selling eggs at the market for as long as Sofia could remember. Mrs. Phelps gave Sofia a warm smile. “Morning, Sofia! Would you like to pick your eggs?”
Sofia carefully selected a dozen eggs, checking each one to make sure it wasn’t cracked. Mrs. Phelps packed them into a carton and added a little feather on top. “A lucky feather for my best customer,” she said with a wink.
Sofia smiled. “Thank you!”
Next, they stopped by Mr. Patel’s fruit stall, where crates of blueberries, strawberries, and peaches shimmered under the morning sun.
“Here to stock up for pancakes, I see,” Mr. Patel said with a grin, already knowing their usual routine.
Sofia nodded eagerly. “Yes, please! Can I pick the blueberries?”
“Of course,” Mr. Patel said, handing her a basket.
Sofia carefully chose the plumpest, juiciest blueberries she could find. She gave one a gentle squeeze to make sure it wasn’t too soft, and when she was satisfied, she handed the basket to her dad.
“Excellent work,” Dad said. “These are going to make some incredible pancakes.”

As they continued their way through the market, Sofia’s favorite part was always stopping at the bread stand. The smell of fresh-baked bread and pastries filled the air, making her stomach rumble. The baker, Ms. Lena, waved at them from behind her counter.
“Morning, Sofia! The usual loaf of sourdough?”
Sofia grinned. “Yes! And maybe… one of those chocolate croissants?”
Ms. Lena laughed. “I thought you might ask.” She wrapped up a croissant in paper and handed it to Sofia. “A little treat for my best helper.”
Sofia’s dad gave her a knowing smile. “I guess it’s okay to spoil my shopping assistant today.”
Sofia beamed, clutching the warm croissant in her hands. It felt like a little treasure.

Once they had everything on their list, Sofia and her dad wandered through the rest of the market, just for fun. They stopped to listen to a man playing guitar, watched a woman weave baskets from colorful strips of cloth, and petted a friendly golden retriever sitting beside a flower stall.
At the very end of the market, they found something new—a small booth selling potted herbs. Sofia’s eyes lit up. She had always wanted to grow something of her own.
“Can we get one?” she asked, tugging on her dad’s sleeve.
“Hmm... What kind of herb would you take care of?” Dad asked with a grin.
Sofia studied the plants. There were rosemary, thyme, and mint, but one little pot caught her eye—it held a tiny basil plant, its leaves bright green and fragrant.
“This one,” Sofia said firmly. “We can use it for pizza!”
“Pizza basil!” Dad said with a chuckle. “Good choice.”
They bought the plant and tucked it carefully into their bag, along with the eggs, blueberries, and bread. Sofia felt proud knowing she would help take care of the little plant and watch it grow.

When they arrived home, Sofia and her dad unpacked their market finds. Sofia set the basil plant on the kitchen windowsill, right where it would get plenty of sunlight. Then she helped her dad crack eggs, stir pancake batter, and fold in the fresh blueberries she had picked so carefully.
As the pancakes sizzled on the stove, Sofia set the table with plates, forks, and napkins. She even poured two glasses of milk—one for her and one for Dad.
The first pancake flipped perfectly golden-brown, and soon they sat down together, their plates stacked high with pancakes dripping in syrup. Sofia took a bite and grinned. The blueberries were just right—sweet, juicy, and bursting with flavor.
“These are the best pancakes ever,” she declared, her mouth full.
Dad laughed. “Well, they were picked by the best assistant shopper, after all.”
They finished their breakfast, chatting and laughing, and when they were done, Sofia climbed onto a chair to check on the basil plant. Its little leaves still looked bright and happy in the sunshine.
“I think our basil is going to love it here,” Sofia said proudly.
Dad smiled, resting a hand on her shoulder. “Just like I love spending time with you.”
Sofia leaned against him, her heart full and happy. “Me too, Dad. I can’t wait to go back to the market next Saturday.”
And from that day on, their Saturday mornings became more than just a trip to the farmers’ market. It became a tradition they both looked forward to—a little adventure filled with familiar faces, simple joys, and the sweetest memories made together.

The End."
Ilo the Little Builder,Family and Everyday Life,"
Every morning, on his way to school, Ilo passed a big construction site. It was noisy and full of workers wearing bright yellow helmets. They drove diggers, hammered nails, and carried wooden beams on their shoulders. Ilo always slowed down to watch, fascinated by how a pile of dirt could one day turn into a house.
""I want to be a builder someday,"" Ilo told his mom one morning as they walked past the site. His mom smiled. ""Maybe one day you will be.""

That day, Ilo's class had Career Day, where people from the community visited the school to talk about their jobs. There was a firefighter, a nurse, a baker, and even a zookeeper. But Ilo was most excited when Mr. Turner, the construction manager from the site, came in to talk about being a builder.
""Builders make things!"" Mr. Turner said with a grin, pulling out some big blueprints. ""We build houses, schools, parks—everything! We work as a team to bring ideas to life.""
After his talk, Mr. Turner invited Ilo and his class to visit the construction site that weekend. Ilo’s eyes sparkled with excitement. He couldn’t wait!

Saturday morning came, and Ilo's mom took him to the site. Mr. Turner greeted them at the gate with a big smile and a tiny yellow helmet just for Ilo. ""Every builder needs a helmet,"" Mr. Turner said, placing it gently on Ilo’s head.
Ilo felt like a real builder already.
Mr. Turner led Ilo around the construction site, showing him all the amazing machines. Ilo got to sit in a digger, hold a tape measure, and even learned how to mix cement. ""Teamwork is the most important part of building,"" Mr. Turner explained. ""Without everyone working together, nothing would get done.""
Then Mr. Turner showed Ilo a surprise. ""See that little garden shed we’re building at the back?"" he asked. ""We were thinking maybe you’d like to help us finish it.""
Ilo’s jaw dropped. ""Really? Me?""
""Sure!"" Mr. Turner said with a wink. ""Even the smallest builder can make a big difference.""
Ilo was thrilled. He rolled up his sleeves and got to work with the team. He helped carry small wooden planks, measured nails, and even held the toolbox for one of the builders. They showed him how to use a level to make sure everything was straight, and how to hammer carefully. It was hard work, but Ilo loved every minute of it.
When the walls of the shed were finished, Mr. Turner gave Ilo a paintbrush. ""Every project needs a finishing touch. Think you can handle it?""

Ilo grinned. ""You bet!""
He dipped the brush into a bright blue paint can and started painting the wooden walls. By the time he was done, the little shed looked beautiful—a pop of blue among the brick and concrete of the construction site.
""You did a fantastic job, Ilo,"" Mr. Turner said. ""This little shed is going to make a big difference.""
Ilo looked at his handiwork, feeling proud. ""It’s not just a shed,"" he said. ""It’s part of the whole project.""
Mr. Turner smiled. ""Exactly. And that’s the magic of being a builder—you help make something bigger than yourself.""
At the end of the day, Mr. Turner gave Ilo a special builder’s badge. ""For being the youngest—and hardest working—builder on site today,"" he said with a grin. Ilo beamed with pride.
As they left the construction site, Ilo’s mom gave him a big hug. ""You did such a great job, Ilo. I’m proud of you.""

Ilo looked up at the half-finished building and imagined all the people who would one day live there. ""I’m going to be a builder when I grow up,"" he said confidently.
And from that day on, whenever Ilo passed the construction site on his way to school, he gave the workers a little wave—because he knew he wasn’t just a boy watching from the outside. He was Ilo the Little Builder, and he was part of the team.

The End."
The Paper Boat That Wanted to Sail Forever,Friendship and Adventure,"
At the edge of a little town, where the streets sloped gently down to meet a winding river, there was a small boy named Theo who loved to fold paper boats. He made them from whatever scraps of paper he could find—newspapers, old maps, even pages from his schoolbooks (though he was careful not to tear out too many).
Theo would spend his afternoons beside the river, setting his boats in the water one by one and watching them drift lazily downstream. He imagined they were sailing on grand adventures, traveling to places no one had ever seen. But no matter how carefully Theo folded them, the boats never sailed for very long.
Sooner or later, the paper would soften, the boat would sink, and the river would carry it away. Theo always wished his boats could sail just a little farther—maybe even sail forever.

One day, Theo folded a boat from a sheet of paper he found tucked inside an old book of stories. It was thicker than usual, with faint illustrations on the edges—tiny birds and swirling waves. It felt special somehow, like the kind of paper that remembered things.
As Theo set the little boat on the water, he whispered, “Sail far, okay? Farther than any boat ever has.”
And then, something strange happened.
The boat bobbed gently on the water, and instead of tipping or sinking, it picked up speed. A breeze stirred the air, pushing it along, and the little boat glided down the river as if it knew exactly where it wanted to go. Theo jumped to his feet, eyes wide.
""Wait!"" he called, running along the bank. But the boat sailed faster, skimming over ripples and swirling through tiny currents.
For the first time, Theo’s paper boat wasn’t drifting lazily—it was traveling. And it didn’t seem like it wanted to stop.

Theo ran along the riverbank, chasing the little boat as it zipped downstream. It danced through bends, slipped beneath low-hanging branches, and sped past pebbles that splashed in its wake. Theo’s heart raced with excitement.
“Where are you going?” he whispered, breathless but delighted.
The boat seemed to answer by tilting its bow, as if to say, ""Farther—just a little farther.""
As Theo chased it, the river carried them both through places neither had ever seen before. They passed fields of tall grass swaying like waves, and little bridges where frogs sat quietly, watching the boat float beneath them. The air smelled of pine and wildflowers, and the sun sparkled on the water like scattered stars.

Just as Theo began to wonder if the boat would ever stop, the river widened, and a turtle with a worn, mossy shell paddled into view. The turtle’s wise eyes followed the paper boat as it zipped by.
“That’s a fast little thing,” the turtle said, glancing up at Theo as he ran along the riverbank. “Where’s it off to in such a hurry?”
Theo shrugged, catching his breath. “I don’t know. I just want it to keep sailing.”
The turtle gave a slow, thoughtful nod. “Ah, yes. But everything floats until it sinks, and every journey has an end—even the good ones.”
Theo frowned, not liking the thought. “But… what if this boat could keep going forever?”
The turtle gave a small smile, his eyes twinkling. “Forever is a long time, little one. Even the best adventures need a place to rest.”
Before Theo could respond, the boat slipped around another bend in the river, and the turtle waved goodbye with a slow, steady paddle.

Theo hurried after the boat, wondering how long it could sail. But as the sun began to dip behind the hills, the river slowed, and so did the boat. The breeze that had carried it all day softened into a gentle whisper, and the little boat drifted into a quiet pool tucked beneath the branches of an old willow tree.
Theo crouched at the river’s edge, watching as the boat floated still, rocking gently in the water. It hadn’t sunk. It hadn’t torn. But it had finally found a place to rest.
Theo sat cross-legged beside the pool, the cool evening air brushing against his skin. For a moment, he felt sad—he had hoped the boat would sail forever. But as he watched it bob peacefully beneath the willow’s branches, he realized something: every journey has a perfect ending. The little boat had traveled far, farther than any boat before it. And now, it had found the place it was meant to be.
Theo smiled, feeling the kind of happiness that doesn’t need words.
“You did it,” he whispered to the boat. “You sailed farther than ever.”

As the first stars began to appear in the sky, Theo picked up a small, smooth stone from the riverbank and tucked it into his pocket—a memory of the journey. Then, with one last look at the little boat resting beneath the willow tree, he stood up and turned toward home.
The boat stayed behind, floating gently in the quiet pool, as if it had always belonged there. And Theo knew that even though it hadn’t sailed forever, it had traveled exactly as far as it was meant to go—and sometimes, that’s more than enough.

The End."
