Title,Topics,Story
The River of Stars,Magic and Fairy Tales,"
In a quiet village, tucked beneath rolling hills, there was a river that sparkled under the night sky, as if someone had poured starlight into the water. It was called the River of Stars, and though everyone admired its beauty, no one knew where it began. Some said it came from a distant mountain where the moon dipped low to kiss the earth. Others said the stars themselves wept into the river, filling it with their light.
But no one ever followed the river to find out—until Dotty decided she would.

Dotty was a dreamer. She spent her nights lying by the riverbank, watching the stars dance on the water’s surface, and wondered what it would be like to follow the river to its source. One evening, as the first fireflies blinked awake, she made up her mind. She would discover where the River of Stars began, no matter how far it took her.
She packed a lantern and a blanket and slipped quietly out of her house as the moon rose high. The river shimmered beside her, reflecting the sky’s silver glow. With a deep breath, Dotty followed the sparkling water, her heart light with excitement.
As she walked deeper into the night, strange things began to appear along the riverbanks. Silver fish leapt from the water, their scales shining like tiny moons. Glowing lilies bobbed on the surface, and every now and then, a gentle ripple would carry a soft, musical hum through the air, as if the river were singing an ancient lullaby.
Dotty followed the river through meadows and forests, the stars guiding her way. After a time, she reached a place where the river narrowed and shimmered even brighter. A fox with fur the color of twilight sat by the edge, dipping its paw into the water. When it saw Dotty, the fox’s golden eyes gleamed.

“Are you lost, little one?” the fox asked in a voice that sounded like a breeze stirring autumn leaves.
“No,” Dotty answered with a small smile. “I’m following the river to find out where it begins.”
The fox twitched its ears thoughtfully. “The journey won’t be easy,” it said. “Not everyone can find the river’s source. Some lose their way, and others turn back before they reach it.”
“I won’t turn back,” Dotty said, her heart steady. “I want to see where the stars meet the water.”
The fox gave a curious look, then stood up gracefully. “In that case, follow me. I’ll take you as far as I can.”

Dotty followed the twilight-colored fox along the riverbank, where the water began to shimmer more brightly with each step. They passed through an orchard where trees glowed softly, their branches heavy with moon-shaped fruit. The air smelled sweet, like night-blooming flowers, and the river’s hum grew louder, filling the air with gentle music.

As they traveled farther, the forest grew thinner, and soon the stars above felt close enough to touch. The fox stopped at the edge of a meadow bathed in starlight and turned to Dotty.
“This is as far as I go,” the fox said, its golden eyes glimmering kindly. “Beyond here, the river belongs to the stars themselves. You must walk the rest of the way alone.”
Dotty gave the fox a grateful nod. “Thank you for guiding me.”
The fox bowed slightly, then slipped into the shadows, vanishing as quietly as a dream. Dotty turned toward the meadow, her heart fluttering with excitement. She could hear the river’s song now, clearer and sweeter than ever, as if it were calling her forward.
She stepped carefully through the meadow, the soft grass glowing beneath her feet. At last, she reached a place where the river’s water no longer flowed—it rose into the sky, becoming a path of starlight that led toward the horizon.

Dotty gasped in wonder. The river didn’t end—it climbed into the heavens, becoming a bridge of light between the earth and the sky.
Without hesitation, Dotty stepped onto the starlit path. It felt like walking on cool water, yet each step was light and sure. The stars above and below her glimmered brightly, as if welcoming her. She followed the glowing path until, at last, she reached a place where the moon rested on the water, casting silver ripples across the sky.
And there, waiting at the edge of the starlit bridge, stood a figure—an old woman wrapped in robes woven from moonlight. Her eyes were as deep as the night sky, filled with both mystery and kindness.

“You’ve come far, little traveler,” the woman said with a smile. “Few ever make it this far.”
Dotty felt a warmth in her chest, a sense of peace she couldn’t quite explain. “Is this where the River of Stars begins?” she asked softly.
The old woman gave a gentle laugh. “The river has no beginning and no end,” she said. “It flows between worlds—between dreams and waking, between night and day. And those who walk its path find what they need most.”
Dotty tilted her head. “What do I need?”
The old woman reached out and placed a small star into Dotty’s hands. It glowed softly, warm and bright, and Dotty felt it fill her heart with a quiet joy, like the feeling of being home.
“This star will guide you,” the woman whispered. “Wherever you go, its light will remind you of the magic that lives in every moment.”
With a smile, Dotty tucked the star close to her heart. She felt as if she had discovered something far more precious than the river’s source—the knowledge that magic isn’t something to find; it’s something to carry within you.

The old woman gave her a knowing look, then gently touched Dotty’s forehead. In an instant, the starlit path faded, and Dotty found herself standing by the riverbank once more, the first light of dawn creeping over the horizon.
In her hands, the little star still glowed faintly, like a tiny spark of the night sky. Dotty smiled, knowing that no matter where she went, she carried the magic of the River of Stars with her—quiet, steady, and endless.
And from that day forward, whenever she gazed at the night sky or heard the gentle hum of the river, she remembered her journey along the starlit path and the quiet truth she had discovered: some magic can’t be seen—it must be felt.

The End."
The Fairy Parade,Magic and Fairy Tales,"
Every summer, on the night when the first fireflies lit up the meadows, the village children whispered excitedly about the Fairy Parade. It was said that if you stayed awake and waited quietly by the forest’s edge, you might catch a glimpse of fairies dancing through the trees, carrying tiny lanterns and spreading magic in their wake.

But Lucas had never seen the Fairy Parade, no matter how hard he tried. Every year, he would sit patiently by the old oak tree, eyes wide and ears alert, but the fairies never appeared. Some of the other children teased him, saying the fairies weren’t real. But Lucas knew, deep down, that they were.
One warm evening in late June, Lucas decided that this year, he wouldn’t give up. He packed a blanket, a lantern, and a little jar of cookies — just in case the fairies got hungry — and set off to the forest’s edge as the sun dipped below the hills.

The night was soft and warm, the stars twinkling above like friendly eyes. Lucas settled under the oak tree, his blanket wrapped around him, and waited. And waited.
The wind whispered through the leaves. A cricket chirped nearby. The moon climbed higher in the sky. But still, no fairies appeared.
Just as Lucas’s eyelids started to droop, a soft, glimmering light caught his eye. It was coming from deeper inside the forest — faint at first, like the glow of a single firefly, but then more lights appeared, twinkling through the trees like stars come to life.
Lucas’s heart leapt. The fairies! They were real!
Without a second thought, Lucas grabbed his lantern and crept toward the glowing lights, careful not to make a sound. The deeper he went into the forest, the brighter the lights became, until the trees opened into a secret clearing bathed in soft starlight.
And there they were: the fairies.

Tiny, radiant creatures no taller than Lucas’s hand, their wings shimmering like dewdrops in the moonlight. Some wore gowns made of petals, others had cloaks woven from spider silk, and each one carried a tiny lantern glowing with magic light. They floated through the air, their laughter as light as a breeze, spinning and twirling in a dance so graceful it made Lucas’s heart swell with wonder.
Lucas stood still, too enchanted to move, afraid that even the smallest sound would frighten them away. But then, as if sensing his presence, one of the fairies turned and saw him. Her wings glimmered like stardust, and she had bright, curious eyes that sparkled with mischief.
“You’re awake!” the fairy said in a voice as light as a bell. “Finally, someone stayed awake to see the parade!”
Lucas smiled shyly. “I’ve been waiting for so long,” he whispered.
The fairy giggled. “We know! We’ve seen you every year by the old oak tree. We wondered when you’d come join us.”
Before Lucas could reply, the fairy zipped closer and held out her tiny hand. “Come on! You can’t just watch the parade — you have to be part of it!”
Lucas hesitated for only a moment, then placed his hand near hers. With a twinkle of magic, the fairy waved her tiny wand, and suddenly, Lucas felt as light as a leaf on the wind.

He gasped as his feet lifted off the ground. He was flying!
The fairies laughed with delight and gathered around him, swirling like a dance of fireflies. “Come on!” they called. “The parade is starting!”
Lucas grinned, his heart bursting with joy, and joined the fairies as they soared through the forest. They twirled around branches, skipped over streams, and floated between glowing flowers. Everywhere they went, magic spread in their wake — flowers bloomed brighter, leaves shimmered with moonlight, and the fireflies joined the dance, their lights flickering in rhythm with the fairies’ song.

As they danced, the fairy who had found Lucas zipped up beside him. “You’re a natural!” she said with a grin. “Have you ever thought about becoming an honorary fairy?”
Lucas’s eyes widened. “Can I really?”
The fairy winked. “Of course! All it takes is a little belief — and maybe a cookie.”
Lucas laughed and reached into his pocket, pulling out the jar of cookies he’d brought. The fairies cheered as they each took a tiny crumb, nibbling happily.
“This is the best night ever,” Lucas whispered to himself, spinning through the air with the fairies.
The parade continued until the first light of dawn began to peek over the horizon. As the sky turned soft and pink, the fairies began to drift back to their hidden homes among the leaves and flowers.
“You’ll come again, won’t you?” the fairy asked as Lucas’s feet gently touched the ground once more.
Lucas smiled. “Every year,” he promised.

The fairy beamed, her wings glowing faintly in the early morning light. “We’ll be waiting!”
With a final twirl, the fairies vanished into the trees, leaving only a faint shimmer of magic in the air.
Lucas stood quietly, his heart full of happiness. He knew the other children might not believe him, but that didn’t matter. He had danced with fairies, flown through the forest, and shared cookies with magical creatures. And every summer from that night on, he knew exactly where he would be — right at the edge of the forest, waiting for the Fairy Parade to begin.

The End."
The Bakery of Enchanted Cakes,Magic and Fairy Tales,"
In a cozy little village nestled between rolling green hills, there was a bakery unlike any other. It was called Tara’s Bakery, and it was famous for making the most delicious cakes in the world. But what most people didn’t know was that every cake baked in Tara’s kitchen carried a touch of magic.

The baker, Tara, was a warm, cheerful woman with twinkling eyes and curly hair that always smelled like cinnamon and sugar. She had learned the secret of enchanted baking from her grandmother, who had whispered to her one night, “The right pinch of magic can make even the smallest moment special.”
Every morning, Tara would unlock the doors of her bakery and welcome the villagers with a bright smile. She baked cakes for all kinds of occasions—birthdays, weddings, and just-because days. But the most wonderful part of Tara’s Bakery was this: she never knew exactly what kind of magic her cakes would create.
One day, Max, a little boy with a curious mind and a big love for adventure, visited the bakery. His nose pressed up against the glass, and his eyes sparkled as he saw the colorful cakes lined up on the shelves—rainbow cupcakes, cloud-soft lemon tarts, and even chocolate moons that glimmered like stars.

Tara chuckled from behind the counter. “Looking for a treat, Max?”
Max grinned. “I want a cake! But... a special one. Something magical.”
Tara’s eyes twinkled. “Ah, well, you’ve come to the right place.” She reached beneath the counter and pulled out a small cupcake with frosting swirled like the evening sky. Tiny edible stars sparkled on top, and as Tara handed it to Max, she whispered, “This one is special. It’s a Wish Cake.”

Max’s eyes went wide. “A Wish Cake? What does it do?”
Tara smiled. “Take a bite, close your eyes, and make a wish. You might just find yourself on an unexpected adventure.”
Max couldn’t resist. He took a big bite of the cupcake, the frosting soft and sweet on his tongue. He squeezed his eyes shut tight and whispered, “I wish for an adventure.”
The moment he made his wish, the air around him shimmered with a soft, golden glow. Suddenly, Max felt himself lift off the ground, and before he knew it, he was floating!
With a whoosh, he was swept out the door and up into the sky, carried by a swirl of cupcake-scented magic. Max giggled with joy as he floated higher and higher, passing over treetops and rooftops, until he found himself drifting toward a floating island made of candy.
The island sparkled under the sun, with gumdrop mountains and candy cane bridges. The air smelled of caramel, and cotton candy clouds drifted lazily across the sky. Max landed softly on a jellybean path, his feet bouncing slightly as they touched the ground.

“Whoa,” Max whispered. “This is the best adventure ever.”
Just then, a group of chocolate rabbits bounded over, their noses twitching. “Welcome to the Candy Isles!” one of the rabbits said with a hop. “We’re in need of a hero—can you help us?”
Max stood up proudly. “I’d love to help! What do you need?”
The chocolate rabbits explained that a peppermint dragon had fallen asleep at the top of the Gumdrop Mountain, and its snores were causing all the candy on the island to melt! The only way to wake it was to give it a very special treat—a Giggle Cake baked with joy and laughter.
“But we don’t know how to make a Giggle Cake,” the rabbits said, their ears drooping. “Only Tara’s Bakery knows how to bake one.”
Max grinned. “Don’t worry! I know Tara’s recipes!”
He rolled up his sleeves and set to work, gathering ingredients from all over the Candy Isles—sprinkles from the clouds, honey from the jellybean beehives, and marshmallow fluff from the candy forests. The chocolate rabbits cheered him on as Max mixed, stirred, and laughed his way through the recipe, knowing that the secret ingredient was always a bit of joy.
At last, the Giggle Cake was ready—a small, pink cake with frosting that shimmered like laughter. Max carefully carried it up the Gumdrop Mountain, the chocolate rabbits bouncing along behind him.

When they reached the top, there lay the peppermint dragon, curled up like a giant striped candy cane, snoring so loudly that the ground trembled beneath their feet. Max gently placed the Giggle Cake in front of the dragon’s nose.
The moment the dragon sniffed the cake, its eyes popped open, and it let out a great, joyful chuckle. The sound of the dragon’s laughter echoed across the Candy Isles, and as it laughed, the candy stopped melting, the sun shone brighter, and the air filled with the sweet sound of joy.
The peppermint dragon stretched its wings, sending a refreshing minty breeze across the island. “Thank you, little one,” the dragon rumbled kindly. “That was the best cake I’ve ever tasted!”
Max beamed. “It was fun to bake it!”
The chocolate rabbits cheered, and the dragon gave Max a playful nudge with its nose. “You’ve brought joy back to the Candy Isles,” it said. “And for that, you deserve a ride home.”
With a flap of its wings, the peppermint dragon lifted Max into the air, carrying him on a gentle breeze. Max laughed as they soared through the sky, the Candy Isles growing smaller beneath him.
Before he knew it, Max was floating gently back down to Tara’s Bakery, where the cupcake’s magic faded, leaving behind a soft shimmer of sugar on his clothes.

Tara smiled warmly as Max landed. “How was your adventure?”
Max grinned from ear to ear. “The best ever! I met a peppermint dragon and chocolate rabbits, and I baked a cake that saved the whole Candy Isles!”
Tara chuckled, her eyes twinkling. “I knew the Wish Cake would bring you somewhere wonderful.”
From that day on, Max visited Tara’s Bakery every chance he got, always ready to see what new magic her cakes would bring. And whenever he smelled cupcakes or saw stars twinkling in the frosting, he knew that adventure—and a little bit of magic—was never far away.

The End."
The Dragon of Ember Hollow,Magic and Fairy Tales,"
In a land where rolling hills touched the sky and mist curled like whispers over the valleys, there was a small village called Ember Hollow. The villagers were simple folk, farmers and storytellers, who loved to sit by their hearths and speak of the days when dragons still roamed the land.
Dragons had disappeared long ago, and only the oldest of the elders still remembered the tales of their greatness — how they guarded the mountains, their scales shimmering like jewels, and how their breath could warm even the coldest nights. But those were just stories now, and no one believed they would ever see a dragon again.
No one, that is, except for Lina.

Lina was a girl with a heart full of dreams and a spirit full of adventure. While the other children played in the fields, Lina would wander to the edge of the forest, staring up at the mist-covered mountains, hoping for a glimpse of something magical. She always believed that dragons were real, even if no one else did.
One autumn evening, as the village prepared for the Harvest Festival, Lina heard a strange sound — a deep, rumbling noise that seemed to come from the sky. She looked up just in time to see a shadow sweeping across the clouds, a shape too large to be a bird, with wings that seemed to stretch across the horizon.
Her heart skipped a beat. “A dragon!” she whispered, excitement bubbling up inside her.
Without a second thought, Lina raced toward the mountains, her feet flying over the hills as the sun began to dip behind the peaks. She didn’t stop until she reached the edge of the forest, where the trees grew tall and twisted, and the air smelled of pine and earth.
And then, in the clearing just ahead, she saw it.
A dragon.

It was the most magnificent creature she had ever seen. Its scales were a deep, fiery red, like glowing embers, and its eyes gleamed like molten gold. Smoke curled from its nostrils as it lay coiled on a bed of rocks, its long, spiked tail swaying gently behind it.
Lina’s breath caught in her throat. The dragon was real. And it was right in front of her.
For a moment, she didn’t dare move. But then the dragon turned its head, and its golden eyes locked onto hers.
“You’re not afraid,” the dragon rumbled, its voice deep and ancient, like the shifting of mountains.
Lina swallowed hard. “No,” she said softly. “I’m not.”
The dragon raised its head, studying her with curiosity. “Most would run from a creature like me.”
Lina shook her head. “I’ve been waiting to see a dragon my whole life.”
The dragon’s eyes narrowed, a flicker of something like amusement in them. “Have you now? And what would a small human like you do with a dragon?”
Lina hesitated, then spoke from her heart. “I don’t want to do anything. I just… I want to understand.”
The dragon blinked, clearly surprised by her answer. “Understand what?”
“Why dragons disappeared,” Lina said. “Why you’re all gone.”
For a long moment, the dragon was silent, its gaze distant. Then it spoke, its voice softer this time. “We did not leave because we wanted to. The world changed, and we no longer fit in it.”
“What do you mean?” Lina asked, stepping closer.

The dragon’s golden eyes watched her carefully. “There was a time when humans and dragons lived in harmony. We guarded the mountains, kept the rivers flowing, and shared the skies with birds and clouds. But over time, humans grew afraid of us. They saw our size, our fire, and thought we were dangerous. So they drove us away, until we had no place left to go.”
Lina’s heart ached. “That’s not fair,” she whispered.
The dragon lowered its head, resting it gently on the ground. “No, it wasn’t. But that is the way of things. Now we live in hidden places, in the deepest caves and the highest peaks, where the world cannot reach us.”
“But you came here,” Lina said, looking up at the dragon with wide eyes. “Why?”
The dragon let out a long, slow breath, smoke curling from its nostrils. “The world is changing again. Magic, which once flowed freely, is fading. The mountains no longer hum with ancient songs, and the rivers grow quiet. I came to see if there were still those who remembered — those who believed in things beyond what they can see.”
Lina felt a lump rise in her throat. “I believe.”
The dragon’s eyes softened. “Yes, I can see that. And it is why I will give you something special.”
Lina stepped closer, her heart pounding with excitement. “What is it?”
The dragon raised one of its great wings, revealing a single, glowing scale nestled among the others. The scale was bright red, like a living ember, and it pulsed with a soft, warm light.
“This scale carries the last of the old magic,” the dragon said. “As long as you keep it safe, magic will never fully fade from this world.”
Lina reached out, her fingers trembling as she took the scale. It was warm to the touch, like holding a piece of the sun.
“Thank you,” she whispered.

The dragon rumbled softly, almost like a purr. “Keep it close to your heart, and it will guide you. But remember, the true magic is not in the scale — it is in the belief that magic still exists, even in the quietest corners of the world.”
Lina nodded, clutching the scale to her chest. “I won’t forget.”
The dragon rose to its full height, its wings stretching wide, casting a shadow over the clearing. “I must go now, back to the mountains. But know this—dragons are never truly gone. We are simply waiting for the world to believe in us again.”
With a powerful beat of its wings, the dragon lifted into the sky, its great form disappearing into the clouds. Lina watched it go, her heart full of wonder and warmth.
She stood in the clearing for a long time, feeling the weight of the glowing scale in her hand. Then, as the last light of day faded, she turned and made her way back to Ember Hollow.
And from that day forward, Lina carried the dragon’s scale with her, a reminder that magic was real, and that even in a world that sometimes forgot, there were always those who believed.

The End."
