Title,Topics,Story
The Boy Who Drew the Stars,Friendship and Adventure,"
In a small seaside village, where the waves whispered against the shore and the wind carried the scent of salt and pine, lived a boy named Leo. Leo wasn’t like the other children, who spent their days running on the beach or building sandcastles. He liked to sit quietly in his little house at the top of the hill, filling the pages of his sketchbook with stars.
Leo loved the stars more than anything. Every night, as the village slept, he would climb up to his favorite spot — a rocky cliff that overlooked the ocean — and draw the constellations he saw above. He never tired of the way they shimmered, distant and untouchable, scattered like tiny treasures across the night sky.
But there was one thing that made Leo sad. The stars seemed so far away — so high above the earth, beyond the reach of anyone. No matter how many he sketched or how perfectly he captured their shapes, he couldn’t help but wish that just once, he could bring the stars closer.

One afternoon, as Leo sat at his usual spot by the cliffs, a girl named Nora wandered over. Nora was the kind of person who always seemed to carry a bit of sunshine in her pocket, even on rainy days. She had freckles on her nose and wind-tangled hair, and she was always curious about the things Leo drew.
“What are you working on today?” Nora asked, plopping down beside him.
Leo flipped through the pages of his sketchbook, showing her his drawings — big constellations shaped like lions and eagles, tiny stars drawn with careful dots. “It’s the stars,” he said quietly. “I like drawing them. But… they feel so far away.”
Nora rested her chin in her hands, thinking for a moment. “What if,” she said with a grin, “we make them feel closer?”
Leo blinked. “How?”
Nora stood up, brushing sand from her shorts. “Come on! We’ll find a way.”
Leo wasn’t sure what she meant, but he liked the way Nora’s ideas always felt a little like adventures, so he followed her down the hill.

Together, Leo and Nora searched the village for things that sparkled and glowed. They gathered seashells that shimmered like pearls, pieces of broken glass from the beach that the ocean had polished smooth, and strings of tiny lanterns from the village market.
“We’ll make our own stars,” Nora said. “Ones we can touch.”
That evening, they climbed back up to the cliff with their treasures. As the sun dipped below the horizon, Leo and Nora began to hang the lanterns on the branches of the pine trees that lined the cliffs. They tucked the glowing seashells into the rocks and scattered the glass pieces on the ground, where they caught the light of the setting sun and sparkled like distant stars.
By the time the sky grew dark, their little patch of the world looked like a constellation come to life. The lanterns swayed in the breeze, glowing softly, and the shells and glass sparkled beneath their feet.
Leo stood back, gazing at the scene with wide eyes. For the first time, it felt like the stars had come down to earth, filling the night with their quiet magic.
Nora nudged him gently. “See? Now the stars aren’t so far away.”
Leo smiled, his heart light. “It’s perfect.”

The two friends lay back on the cool grass, watching their homemade stars sway and twinkle above them. The real stars glimmered far beyond, but tonight, they didn’t feel quite so distant.
“This is better than any drawing,” Leo whispered, hugging his sketchbook close.
Nora grinned. “That’s because you made it real.”
For a long time, they lay in comfortable silence, listening to the waves and the rustle of the wind through the trees. The night felt full of possibility, as if the whole world was waiting just beyond the horizon, ready for whatever they might dream next.

Before they left the cliff, Nora reached down and picked up a small piece of glass that sparkled like a star. She placed it gently in Leo’s hand. “Here,” she said. “Now you can keep a little piece of tonight with you. For whenever the stars feel too far away again.”
Leo turned the glass over in his fingers, the edges smooth and cool. It wasn’t much — a tiny, glimmering piece of an ordinary thing — but it felt like a piece of something important.
“Thanks, Nora,” he said quietly.
Nora gave him a playful nudge. “And if the stars ever feel far again, we’ll come back and make more.”
Leo smiled, tucking the little glass star into the pocket of his sketchbook. “Deal.”

From that night on, Leo no longer worried about the stars being too far away. Whenever he felt small beneath the vast sky, he would open his sketchbook, touch the little piece of glass Nora had given him, and remember that some stars are close enough to hold — especially the ones made with a friend.
And whenever the sky was clear and the night felt just right, he and Nora would climb back up to the cliffs, hang their lanterns in the trees, and fill the night with stars they could touch.
Because sometimes, all it takes to bring the stars a little closer is a good idea, a handful of glowing things, and a friend who believes in your dreams.

The End."
The Train to Nowhere in Particular,Animals,"
On the edge of a quiet little town, there was a train station that no one ever seemed to use. The platform was dusty, the wooden benches creaked, and a weathered sign simply read: ""Nowhere in Particular – Platform 3.""
For as long as anyone could remember, the Train to Nowhere in Particular had arrived every Saturday morning at 8:13 sharp. No one in the town knew where it went, and no one had ever dared to hop aboard. Some thought it was broken, others thought it had no destination. But most simply forgot about it—except for a small, curious tortoise named Miles.
Miles wasn’t the kind of tortoise who liked to stay still. While other tortoises were happy to lounge in gardens or munch on lettuce, Miles dreamed of going places—faraway places, even if he didn’t know exactly where. He often visited the old train station, sitting quietly on the platform, imagining what might lie beyond the horizon.
One crisp Saturday morning, just as the sun was rising, Miles arrived at Platform 3 with a tiny backpack strapped to his shell and a heart full of curiosity. Today, he had made up his mind: he was going to board the Train to Nowhere in Particular and see where it led.
As the train pulled into the station with a cheerful chugga-chugga, Miles’ eyes sparkled. The train was old but well-loved, with carriages painted a deep green and big brass bells that jingled as it slowed to a stop. Steam hissed from the engine, and the door to the first carriage opened with a soft squeak.
With a deep breath and a steadying pat on his backpack, Miles climbed aboard.

Inside the carriage, Miles found a cozy little world. The seats were upholstered with soft cushions, and the walls were lined with potted plants. At the far end of the car sat the conductor—a dapper squirrel in a red vest, balancing a pair of round spectacles on his nose.
""Well, well!"" the conductor said, adjusting his spectacles. ""A passenger at last! Welcome aboard the Train to Nowhere in Particular.""
""Where does it go?"" Miles asked, settling onto a soft seat.
""Ah,"" said the conductor with a grin, ""it goes wherever it likes—and always exactly where it needs to be.""
Before Miles could ask what that meant, the whistle blew, and the train lurched forward. Miles peeked out the window as the landscape began to roll by—fields of flowers, sleepy hills, and quiet streams. The train didn’t seem to be in a hurry. It clacked along cheerfully, as if it had all the time in the world.

As the train chugged along, Miles wandered through the carriages, curious to see who else might be aboard. In the second carriage, he found Freddy the fox, who wore a striped scarf and sat cross-legged on a seat, sketching clouds in a little notebook.
""Where are you going?"" Miles asked.
Freddy smiled, his pencil gliding across the page. ""I’m not sure yet. Maybe somewhere with good snacks. Or perhaps I’ll stop where the sky looks just right.""
In the next carriage, Miles found a sleepy owl named June, snuggled under a quilt. She cracked open one eye as Miles shuffled past.
""Why are you on the train?"" Miles asked her softly.
June yawned. ""Oh, I like the ride. There’s something nice about not knowing exactly where you’ll end up. Sometimes, the journey’s the best part, don’t you think?""
Miles nodded thoughtfully. He wasn’t sure if he understood it all yet, but something about it felt... right.

After a while, the train gave a gentle jolt and began to slow. ""First stop!"" called the conductor cheerfully. ""Nobody knows where!""
The train rolled to a halt beside a wild sunflower field, where hundreds of tall, golden flowers swayed in the breeze. Freddy the fox leapt off the train, his scarf trailing behind him.
""Perfect spot for a picnic,"" Freddy said, tossing a wave over his shoulder. ""Maybe I’ll catch the train again later. Or maybe not! We’ll see!""
Miles watched Freddy wander into the sunflower field, humming a tune. A little voice inside him whispered: ""What if you’re supposed to stop here too?""
But before Miles could decide, the whistle blew, and the train gave a little shudder. The conductor poked his head into the carriage. ""Staying aboard, are you? No rush. Plenty of adventures still ahead.""
Miles stayed in his seat, though he wondered if he had missed something by not following Freddy into the sunflower field. Had that been where he was supposed to stop?

As the train rocked gently along, Miles sat deep in thought. Finally, he turned to the conductor. ""How do you know when you’re supposed to get off the train?"" he asked.
The conductor gave him a kind smile. ""Ah, now that’s the trick, isn’t it? There’s no right or wrong stop, little friend. The joy is in exploring them all. You can hop off whenever something feels just right—or you can stay on board as long as you like. Either way, there’s no rush. You’ll find what you’re looking for when you’re meant to.""
Miles sat quietly for a moment, letting the conductor’s words sink in. He liked the idea that there wasn’t just one perfect stop—that every stop might have its own kind of magic, if you were willing to see it.

As the train rolled onward, Miles felt a lightness in his shell that he hadn’t felt before. He leaned out the window, watching the trees and rivers pass by, knowing that wherever he stopped—whether it was at the next station or far down the line—it would be exactly where he was meant to be.
For now, though, the journey itself felt like enough.
He smiled, watching the horizon unfold in front of him like a story still waiting to be told.

The End."
The Blanket Fort,Family and Everyday Life,"
It had been raining all day, and Maya was bored. She sat on the living room couch, staring out the window as raindrops raced each other down the glass. Her little brother, Ben, sat on the floor playing with his toy cars, but even he looked tired of being stuck inside.
""Mom, what can we do?"" Maya called from the couch.
Her mom peeked in from the kitchen with a knowing smile. ""How about we build a blanket fort? You two used to love making those.""

Maya perked up, and Ben’s eyes lit up. ""A fort!"" he squealed, scrambling to his feet.
Their mom laughed. ""I’ll leave you to it — go gather what you need.""
Maya and Ben dashed around the house, collecting pillows, blankets, and cushions. Maya grabbed the big quilt from her bed, and Ben dragged a stack of pillows as tall as he was into the living room. Before long, the room was full of everything they needed to build the best fort ever.
""Okay,"" Maya said, hands on her hips. ""We need a plan.""
Ben looked up at her, grinning. ""Can it have two rooms? Like a castle?""
Maya thought about it and nodded. ""Yeah! One for us, and one for snacks!""
The idea was brilliant. They got to work right away, draping blankets over the couch, balancing pillows against chairs, and using a broom to prop up the roof. Ben’s job was to crawl inside and make sure the rooms were just right, and Maya kept adjusting blankets to make sure everything stayed in place.

After a few wobbles and some giggles, the fort finally came together. It had a snack room, a pillow throne, and even a little window made from a folded blanket.
""It’s perfect!"" Ben declared as he plopped onto a pile of cushions.
Maya grinned. ""Okay, we need snacks.""
Their mom, who had been watching with an amused smile, helped them fill a tray with popcorn, apple slices, and juice boxes. ""Here you go, builders. Enjoy your castle.""
Maya and Ben crawled into their fort with the snack tray and closed the ""door"" behind them. Inside, the fort felt cozy and secret, as if the rain outside didn’t exist at all. The soft blankets muffled the sound of the storm, and the pillows made the perfect place to snuggle in.
Ben leaned back with a sigh, holding his juice box like a king on his throne. ""This is the best castle ever.""
Maya nodded in agreement. ""It’s not just a castle,"" she whispered. ""It’s our secret hideout.""
They spent the rest of the afternoon in their fort, telling stories and pretending they were on an adventure. In one story, they were pirates searching for treasure; in another, they were astronauts flying to the moon. The fort became whatever they wanted it to be — a pirate ship, a rocket, a dragon’s cave.

When the rain started to let up, their mom peeked into the fort. ""How’s it going in there?"" she asked, smiling.
""Awesome!"" Ben said with a big grin, his mouth full of popcorn.
""Can we sleep here tonight?"" Maya asked, already knowing the answer she hoped for.
Their mom pretended to think about it, tapping her chin. ""Hmm... as long as the fort doesn’t fall apart by bedtime, you have a deal.""
Maya and Ben high-fived each other. ""Yes!""
That night, after brushing their teeth and changing into pajamas, Maya and Ben snuggled into the fort with their pillows and blankets. Their dad came in to tuck them in, smiling as he peeked into the cozy little hideout.
""All set for your adventure?"" he asked as he adjusted the blanket roof.
Ben yawned. ""Yeah. We’re going to the moon in the morning.""
Their dad chuckled and gave each of them a kiss on the forehead. ""Sweet dreams, astronauts.""

As the lights went out, Maya lay in the soft glow of a flashlight they had propped up in the corner. The rain had stopped, but the world outside still felt distant, as if they were in their own special place where time didn’t matter. Ben was already asleep, his tiny snores making Maya giggle quietly.
She hugged her pillow and smiled to herself, feeling warm and safe inside their little fort. It didn’t matter that it had been a rainy day. In their blanket fort, anything was possible.
And with that happy thought, Maya drifted off to sleep, dreaming of rockets, treasure maps, and faraway adventures.

The End."
The Grocery Store Treasure Hunt,Family and Everyday Life,"
It was a rainy Saturday afternoon, and Maya and her dad were off to do the grocery shopping. Maya didn’t really love grocery shopping—it was boring, and the store always felt too big. But since her mom was home with Maya’s baby brother, today it was just her and Dad.
“Alright, kiddo,” Dad said as they parked the car. “This isn’t just any shopping trip. This is a mission.”
Maya perked up. “A mission?”
Dad grinned. “That’s right! We’re on a grocery treasure hunt. If we find all the items on the list, we unlock the greatest treasure of all... ice cream!”
Maya’s eyes sparkled. Ice cream? That sounded like the best kind of treasure! “Okay! What’s on the list?”
Dad handed her a piece of paper. “You’re in charge of reading the list,” he said. “And I’ll push the cart. Teamwork is key.”

As soon as they entered the store, Maya pulled the list out of her pocket and read the first item aloud: “Bananas!”
“Bananas! To the fruit section!” Dad announced, steering the cart toward the colorful displays.
Maya zoomed ahead, scanning the shelves until she spotted a bright yellow bunch of bananas. “Found them!” she shouted triumphantly.
“Nice work, treasure hunter,” Dad said, adding the bananas to the cart. “Next?”
Maya checked the list again. “Hmm… bread. That’s in the bakery section.”
Together, they navigated the aisles, weaving between other shoppers. When they reached the bakery, the warm smell of fresh bread made Maya’s tummy rumble.
“Do we need rolls, or a loaf of bread?” Maya asked, holding a fluffy loaf in her hands.
Dad grinned. “Let’s go with both—just in case we get extra hungry.”
Maya giggled. “Good call.”

They made their way through the store, ticking off each item on the list. They found apples, cereal, and even Maya’s favorite peanut butter. When they reached the dairy aisle, Maya checked the list.
“Uh-oh,” she said with a sly smile. “It says we need... cheese! That means you have to pick one.”
Dad groaned dramatically. “Not the cheese aisle! So many choices!”
Maya laughed as Dad held up one cheese after another, pretending he couldn’t decide. “This one is too cheesy,” he said. “And this one is not cheesy enough.”
Finally, Maya picked a block of cheddar and dropped it into the cart. “Crisis averted!” she declared.

Just when Maya thought the shopping was almost done, they reached the snack aisle. Dad looked at her with a twinkle in his eye. “We’re in dangerous territory now. Snacks ahead!”
Maya grinned. “We need popcorn. Mission critical.”
They found the popcorn section, but there were so many flavors—cheddar, caramel, butter, and even chocolate-covered popcorn. “Which one should we get?” Maya asked, her head spinning.
Dad scratched his chin. “How about... one of each?”
Maya’s mouth dropped open. “Really?”
Dad chuckled. “Just kidding. Butter it is.”

At last, they reached the checkout line, the cart filled to the brim. Maya held the list proudly. “We found everything!”
“Great job, treasure hunter,” Dad said, giving her a high five. “Now, let’s get to the treasure part.”
After paying for their groceries, they made one final stop at the freezer section. Dad opened the door, and cold air whooshed out as Maya stared at the rows of colorful ice cream cartons.
“You get to pick,” Dad said. “Any flavor you want.”
Maya’s eyes scanned the choices, and finally, she grabbed a tub of mint chocolate chip—her favorite.
“Excellent choice,” Dad said, dropping it into the cart with a smile. “Mission complete!”

When they got home, Maya helped Dad unpack the groceries. As they put away the bread, apples, and cheese, Maya felt proud of their teamwork. Grocery shopping wasn’t boring at all—it had been an adventure!
That evening, after dinner, Dad scooped out bowls of the mint chocolate chip ice cream. As they sat together on the couch, enjoying their well-earned treasure, Maya grinned.
“Next time we go shopping,” she said between bites, “can we make it another treasure hunt?”
Dad smiled. “Absolutely, treasure hunter.”
And from then on, grocery shopping was never just about groceries—it was always an adventure, filled with teamwork, silly moments, and, of course, the sweet reward of ice cream at the end.

The End."
The Garden of Midnight,"Magic and Fairy Tales, Friendship and Adventure","
In a quiet village nestled between rolling hills, two best friends—Betty and Bruno—loved to stargaze. Every night, they sat beneath the sky, making up stories about constellations and distant worlds. But one night, the stars seemed dimmer, and the sky felt unusually quiet.
“Do you think the stars are hiding?” Betty asked, her voice a soft whisper.
Bruno shrugged. “Maybe they’re tired of shining for us.”
Betty smiled. “Then let’s find a place where something still shines, just for us.”
And so, hand in hand, they set off on an adventure—following the silver light of the moon that peeked through the clouds, hoping it would lead them to something magical.
They wandered past the sleepy cottages, through the meadow where fireflies blinked like tiny lanterns, and into the forest where shadows danced among the trees.
“Do you think there’s a secret waiting for us?” Bruno asked, his breath puffing in the chilly night air.
“I hope so,” Betty whispered. “A beautiful secret.”

The forest grew thicker the deeper they went, but the moonlight guided their steps. Just as they began to feel lost, they saw a faint glow peeking from behind a wall of ivy.
“Look!” Betty gasped.
Bruno reached out, and together they pulled the ivy aside, revealing a small wooden door—hidden, ancient, and carved with delicate patterns of leaves and flowers.
Without hesitation, they pushed it open, and what lay beyond took their breath away.

It was a garden—a garden of midnight, shimmering under the silver light of the moon. Flowers that only bloomed in the darkness swayed gently in the cool breeze. Some glowed faintly, as if holding stardust in their petals, while others sparkled with drops of dew that looked like tiny crystals.
Vines of luminescent ivy curled around glowing mushrooms, and a quiet stream flowed through the garden, its waters reflecting the night sky as if the stars had come to rest upon the earth. In the middle of it all stood a tree with leaves like glass, twinkling whenever the wind brushed past.
“It’s like a dream,” Bruno whispered, afraid that speaking too loudly might make it all disappear.
Betty wandered deeper into the garden, touching the glowing petals of a blue flower that pulsed with light, as if it had a heartbeat. “I didn’t know something so beautiful could exist, hidden where no one could see.”

Bruno crouched beside the stream, dipping his fingers into the cool water. As he did, tiny glowing fish darted around his hand like sparks in the night. “It feels like the stars came down just for us,” he said.
The two friends explored every corner of the garden, whispering their awe at each new discovery. They found a bed of soft moss that glittered under their footsteps, and a patch of moon-white roses that gave off the scent of dreams. Everything around them felt alive, as if the garden were breathing, waiting for someone to find it and appreciate its hidden beauty.
“I wonder why it’s hidden,” Betty said, looking around. “Something this beautiful shouldn’t stay a secret.”
Bruno smiled. “Maybe it’s a place for those who look beyond what they can see—for those who believe in secret worlds.”
Betty nodded. “Maybe it’s a gift—just for those who keep wondering.”

They lay down on the soft moss, gazing up at the glittering leaves of the tree above them. The night felt peaceful, and the stars seemed closer somehow, as if they were listening.
After what felt like hours—or maybe just minutes—they knew it was time to leave. They stood hand in hand, taking one last look at the beautiful garden.
“Do you think we’ll ever find it again?” Bruno asked as they stepped back through the wooden door.
“I think we’ll always carry it with us,” Betty said, smiling. “Some secrets are too beautiful to forget.”
And as the door swung shut behind them, the ivy curled back, hiding the entrance once more. But the garden of midnight stayed with them—in their hearts, in their dreams, and in the way they saw the world from that night forward.
Because once you discover a secret that beautiful, the world never looks quite the same again.

The End."
