Title,Topics,Story
The Dragon’s Gift,Magic and Fairy Tales,"
In a land where mountains touched the clouds, rivers sparkled like silver ribbons, and forests hummed with ancient magic, there lived creatures most people only knew from bedtime stories: dragons. These dragons were not fierce beasts, but guardians of the world’s wonders. They hid in secret places, protecting things that were rare and magical — things like moonlight streams, enchanted gems, and music carried on the wind.

Among these dragons was a young, bright-green dragon named Aurel. Aurel was smaller than the others and still learning his way in the world. He was curious, playful, and dreamed of being as wise and brave as the older dragons who guarded the great treasures of the world.
One morning, as the sun peeked over the snowy peaks, Aurel’s mother gave him a task: ""It is time you find your own treasure to protect."" Her golden eyes twinkled warmly. ""But remember, the most precious things are not always what they seem.""
Aurel flapped his wings with excitement and soared into the sky, the wind rushing under his scales. He flew over forests, rivers, and valleys, searching for something truly special — something he could call his own.

After a long day of flying, Aurel spotted a shimmering waterfall tucked between two cliffs. Drawn to its beauty, he glided down and perched beside the pool at the waterfall’s base. As he peered into the clear water, something unexpected happened — a tiny voice called out to him.
""Help me, please!"" the voice whispered.
Aurel blinked in surprise and looked closer. Beneath the water’s surface, tangled in the roots of a water lily, was a small creature — a sprite, no bigger than a butterfly, with wings that sparkled like mist in the morning sun.
Aurel gently dipped his claws into the water and untangled the sprite from the roots. ""There you go!"" he said kindly, lifting her from the water.
The little sprite shivered and fluttered her damp wings. ""Thank you, kind dragon!"" she said, her voice as light as the breeze. ""I am Mira, a water sprite, and I’ve been trapped here for days. What brings you to this hidden place?""
Aurel smiled. ""I’m looking for a treasure to protect. Something rare and magical — something only I can guard.""
Mira’s eyes sparkled. ""Then you’re in luck! There is something truly special deep in the forest, hidden beneath the tallest tree. But it’s not easy to find. Would you like me to show you?""
Aurel’s wings fluttered with excitement. ""Yes, please!""

The little sprite led Aurel through the forest, her wings trailing tiny sparkles in the air. They flew past glimmering streams and groves of whispering trees, until they reached a massive oak tree whose roots burrowed deep into the earth.
""Here it is,"" Mira whispered, pointing to the base of the tree.
Aurel leaned in and saw a glowing egg, nestled safely among the roots. It shimmered with soft light, like the glow of the moon on a calm night. The egg was small, but Aurel could feel the magic inside it — it was unlike anything he had ever sensed before.
""This,"" Mira explained, ""is the last of the Dreamweaver eggs. When it hatches, the dragon inside will weave dreams into the sky, spreading wonder and hope to all creatures. But the egg is delicate, and it needs a guardian to protect it until it hatches.""
Aurel stared at the glowing egg, his heart swelling with awe. ""I’ll protect it,"" he whispered. ""I’ll keep it safe, no matter what.""
Mira smiled. ""I knew you would.""

Days passed, and Aurel stayed by the egg, guarding it through storms, winds, and even curious creatures that wandered too close. At night, he curled his tail protectively around the glowing egg, humming soft songs to it as it shimmered beneath the stars.
But one evening, a shadow passed over the forest. Aurel looked up to see a great black dragon circling above — a dragon known as Umbra, the keeper of forgotten things.
Umbra landed with a thud, her dark scales gleaming like obsidian. ""That egg belongs to the Dreamweavers,"" she said in a deep, rumbling voice. ""It is too precious for a small dragon like you to guard. Give it to me, and I will keep it safe.""
Aurel stood tall, though his heart pounded in his chest. ""I may be small,"" he said bravely, ""but this is my treasure to protect. I promised to guard it, and I won’t let anyone take it.""
Umbra’s eyes narrowed, but then, to Aurel’s surprise, she gave a slow, approving nod. ""You have a brave heart, little dragon,"" she said. ""Bravery is a treasure in itself. The Dreamweaver egg is lucky to have you.""
With a powerful sweep of her wings, Umbra rose into the sky and disappeared into the night, leaving Aurel with the egg.

At dawn, just as the first rays of sunlight touched the treetops, the egg began to glow brighter. Aurel watched in amazement as tiny cracks appeared along its surface, shimmering with light. And then, with a soft pop, the egg hatched.
Out tumbled a tiny dragon, no bigger than a sparrow, with scales that sparkled like stardust. The little dragon blinked up at Aurel, its eyes full of wonder, and let out the smallest, happiest chirp.
""You did it,"" Mira whispered, fluttering beside him. ""The Dreamweaver is born.""
Aurel smiled, feeling a warmth spread through his heart. He knew now that the greatest treasure wasn’t gold or jewels — it was the joy of caring for something magical, something fragile, and seeing it thrive.

From that day forward, Aurel and the little Dreamweaver dragon became inseparable. They soared through the skies together, weaving dreams into the stars, spreading wonder and hope wherever they flew.
And though Aurel had once been small and unsure, he knew now that even the smallest dragon could guard the greatest treasures — as long as he did so with love, bravery, and a heart full of magic.

The End."
The Cloudmaker’s Balloons,Magic and Fairy Tales,"
In a bright and lively village where every house was painted with colors of the rainbow, there was a little girl named Sophie who loved balloons. Her favorite thing in the whole world was to watch the colorful balloons bobbing in the air at the market or floating high above during festivals. But as much as she loved balloons, Sophie had never seen a truly magical one.

One warm summer afternoon, as she wandered through the village square, Sophie noticed an old man standing by a stall she had never seen before. He had a long, silver beard, and his wrinkled face was full of kindness. The sign above his stall read, ""Cloudmaker’s Balloons.""
Sophie’s eyes widened with curiosity. Cloudmaker’s Balloons? She had never heard of such a thing! She hurried over to the stall, where the old man smiled warmly at her.
“Hello, little one,” he said in a voice as soft as a breeze. “Would you like to see something magical?”
Sophie nodded eagerly. “Yes, please!”

The old man reached behind the stall and pulled out a bundle of balloons. But these were not ordinary balloons. Each one shimmered like a piece of the sky, with colors that swirled and changed — soft blues, fluffy whites, and even hints of pink and gold, like the sky at sunset.
“These,” the old man said, “are cloud balloons. They are made from the very clouds above us. Each balloon holds a little bit of magic, and if you let one go, it will take you somewhere wonderful.”
Sophie’s eyes grew wide with wonder. “Really?” she whispered.
“Would you like to try?” the old man asked, holding out a balloon that shimmered like a cloud kissed by sunlight.

Sophie took the balloon carefully, feeling its soft, cool surface in her hands. “Where will it take me?” she asked.
The old man smiled mysteriously. “Wherever the wind and your heart wish to go.”
With a little leap of excitement, Sophie let the balloon go. As it floated into the sky, she felt a gentle tug on her hand, as if the balloon was pulling her upward. And then, to her amazement, her feet lifted off the ground!
Sophie gasped with joy as she began to float up into the sky, her hand still holding the string of the magical cloud balloon. She rose higher and higher, passing the rooftops of the village, until she was soaring among the clouds themselves.

The sky was wide and endless, and the air was soft and warm. As Sophie floated, she saw fluffy white clouds all around her, like pillows in the sky. But these weren’t ordinary clouds. They shimmered with magic, twinkling with little stars that danced in the daylight.
Suddenly, a group of cloud animals appeared — fluffy sheep bouncing through the air, a proud cloud lion with a mane of mist, and even a cloud bunny with ears that flopped as it hopped along the wind. They waved at Sophie with puffs of air, and she laughed in delight.
“Where am I?” Sophie asked aloud, her voice full of wonder.
“You’re in the Cloud Kingdom!” came a voice from behind her.

Sophie turned to see a cloud boy floating nearby, holding his own cloud balloon. His hair was as white as snow, and his clothes were made of wisps of mist. He smiled at her brightly.
“I’m Theo,” the boy said. “Welcome to the Cloud Kingdom! This is where all the magical balloons come from.”
Sophie’s heart leapt with excitement. “I’ve never seen anything like this!”
Theo nodded, his eyes twinkling like the stars hidden in the clouds. “It’s a special place, but only those who believe in magic can find it.”
Sophie grinned. “I believe in magic!”

Together, Sophie and Theo floated through the Cloud Kingdom, exploring its fluffy wonders. They bounced on cloud trampolines, slid down rainbow slides, and flew through the air with the cloud birds that sang sweet, whistling tunes. Everywhere Sophie looked, there was something new and wonderful — a cloud castle with towers made of mist, cloud flowers that bloomed with sparkles, and even a cloud river that shimmered like silver.
After what felt like hours of joyful floating and playing, Theo finally led Sophie to the Cloudmaker’s Palace — a grand building made entirely of swirling clouds. Inside, Sophie met the Cloudmaker himself, an old but jolly wizard with twinkling eyes and hands that shaped the clouds like soft clay.
“I see you’ve found your way here,” the Cloudmaker said, his voice full of warmth. “Did you enjoy your adventure?”
Sophie nodded eagerly. “It’s the best day ever!”

The Cloudmaker smiled kindly. “That’s the magic of the cloud balloons. They bring joy wherever they go. And you, little one, are always welcome to visit the Cloud Kingdom.”
As the sun began to dip low in the sky, casting a golden glow over the clouds, Theo and the Cloudmaker gently lowered Sophie back down to the village with her cloud balloon. Her feet touched the ground as softly as a feather, and she landed right back in the village square, just as the stars began to twinkle in the evening sky.

“Thank you!” Sophie called up to the sky, waving at Theo and the Cloudmaker.
And though the clouds were far above, Sophie was sure she saw them wave back.
From that day on, every time Sophie saw a balloon float into the sky, she smiled, knowing that somewhere up there, in the magical Cloud Kingdom, wonderful adventures were waiting for anyone with a heart full of wonder and a little bit of magic.

The End."
The Little Garden That Traveled,Friendship and Adventure,"
At the end of a narrow street, behind a crooked fence, there was a very small garden. It belonged to Miriam, a girl with big ideas and an even bigger love for plants. Her garden wasn’t fancy—it was just a patch of soil with a few pots filled with herbs, wildflowers, and a tiny tomato plant. But to Miriam, it was the most wonderful garden in the world.
The trouble was, Miriam’s garden never seemed to grow very big. The flowers stayed small, and the herbs wilted if it got too sunny. The tomato plant, no matter how carefully she watered it, refused to grow even a single tomato.
One morning, as Miriam knelt by her plants, sighing softly, she whispered, “I wish my garden could grow somewhere it really belongs.”
To her surprise, a beetle with bright green wings crawled out from under a pot and gave her a curious look.
“Maybe it can,” the beetle said, wiggling its antennae. “Have you ever thought about taking your garden with you?”
Miriam blinked. “Taking it with me? But gardens can’t move!”
The beetle tilted its head. “Why not? You only need a little imagination. Besides, everything grows better on an adventure.”
And with that, the beetle scurried off into the grass, leaving Miriam with an idea that began to bloom in her mind, much like her flowers were trying to do.

The next day, Miriam gathered her favorite plants—the herbs, the tomato, and the little wildflowers—and potted them carefully into old tin cans and teacups. She arranged them all in a wooden wagon her grandfather had built for her.
“If my garden can’t grow here,” she said with determination, “then we’ll find the perfect place for it.”
With a little push, Miriam set off down the street, the wagon rattling behind her. The wildflowers swayed with each bump, and the herbs rustled like they were excited to be moving. Even the tomato plant looked a little perkier in the morning sun.

Miriam pulled her garden through the streets of the town, looking for just the right spot. She tried the meadow by the pond, where frogs croaked and dragonflies buzzed, but it was too damp for her herbs. She tried the top of the hill, where the wind carried the scent of pine trees, but it was too windy for her flowers.
At every stop, Miriam adjusted her little plants, giving them water and tucking the leaves back into place. She felt a bit discouraged, but she was determined to keep going. After all, the beetle had said everything grows better on an adventure.
Just as the sun began to set, painting the sky in soft orange and pink, Miriam reached the edge of the forest. She looked out at the quiet trees, their branches swaying gently in the breeze, and thought, “Maybe this is the place.”

As Miriam knelt by her wagon, arranging her plants in a patch of soft moss, a fox with fur the color of autumn leaves appeared at the edge of the clearing. The fox tilted its head, eyeing the wagon with interest.
“What are you doing out here?” the fox asked, sitting back on its haunches.
“I’m looking for the perfect place for my garden,” Miriam explained. “Somewhere it will finally grow.”
The fox’s golden eyes sparkled. “I think you’ve already found it.”
Miriam frowned. “But it hasn’t grown yet.”
The fox gave a knowing smile. “That’s the thing about gardens—they don’t just grow in one place. They grow with you, wherever you take them.”
Miriam tilted her head, considering the fox’s words.
“Why not let it grow wherever you go?” the fox added. “After all, you’ve already given it a grand adventure.”

Miriam smiled, feeling a little spark of joy bloom inside her. She realized that her garden wasn’t just about flowers blooming in one perfect spot. It had already grown—in every place she had taken it, in every moment she cared for it along the way.
She reached into her wagon and plucked a small sprig of rosemary. “Here,” she said, offering it to the fox. “A little piece of my garden for you.”
The fox sniffed the sprig, then tucked it gently behind one ear. “Thank you,” the fox said with a grin. “Now I have a little adventure too.”
As the sun dipped behind the trees, Miriam gave her wagon a gentle pull, feeling lighter than she had in days. She knew now that her garden didn’t need to stay in one place to grow—it would grow with her, everywhere she went.
And so, Miriam wandered back through the town, leaving little gifts of flowers and herbs along the way—a daisy tucked into the baker’s window, a mint leaf left at the market stall, and a basil sprig on her neighbor’s doorstep.
Her garden grew in every little moment, and wherever she went, she left a trail of green behind her—like a path of kindness, blooming quietly in unexpected places.

The End."
The Great Forest Race,Animals,"
In the heart of a sprawling forest, where the trees grew tall and the rivers sparkled like glass, lived a group of animals who loved nothing more than a good adventure. Every year, they held the Great Forest Race—a friendly competition to see who could reach the top of the Mossy Hill first, where the winner’s prize was a crown of wildflowers and endless bragging rights.
The whole forest was buzzing with excitement. This year’s racers were Ollie the otter, Finn the fox, and Tilly the squirrel—three best friends who were always up for a challenge. They had spent the week leading up to the race teasing each other about who would win.
“I’m the fastest swimmer!” Ollie said, puffing out his chest. “If the race goes near the river, I’ll leave you both in my wake!”
Finn flicked his bushy tail confidently. “You might be quick in water, Ollie, but I’m the fastest on land. I’ll be at the top of Mossy Hill before you even leave the riverbank.”
Tilly twirled her fluffy tail and gave them both a mischievous grin. “Hah! You boys might be fast, but no one knows the treetops like I do. I’ll be sitting on that hill, wearing my flower crown, long before either of you get there!”
The morning of the race dawned bright and cool, with sunlight dappling through the trees and the scent of wildflowers drifting on the breeze. The forest animals gathered at the starting line—rabbits, deer, and birds chirping with excitement, eager to watch the race.
A great old owl named Winston fluttered down from his branch to start the event. “Now, remember,” he said, adjusting his tiny spectacles, “the race isn’t just about speed—it’s about working smart, and perhaps even working together.”
Ollie, Finn, and Tilly glanced at one another, each determined to win. Together? they thought. This is a race! Every critter for themselves!
“On your mark… get set… GO!” Winston hooted, and the three friends dashed off into the forest, each taking a different path toward Mossy Hill.

Ollie the otter splashed happily into the stream, his sleek body cutting through the water like an arrow. “This race is in the bag,” he thought. “I’ll take the river shortcut, and those two will never catch up.”
But just as he rounded a bend, Ollie spotted trouble: a fallen log had blocked the stream, and the water had slowed to a trickle. He tried squeezing through the narrow gap, but it was no use—he was stuck!
“Ugh! This was supposed to be easy!” Ollie grumbled, wiggling and squirming.
Just then, Tilly appeared, leaping gracefully from branch to branch above the stream. “Looks like you’re in a bit of a pickle, Ollie!” she called, giggling.
“Help me out, Tilly!” Ollie pleaded. “If you move that log, I can swim ahead, and I’ll owe you one!”
Tilly twirled her tail thoughtfully. “All right, but only if you promise not to splash me!”
With a few quick nudges, Tilly rolled the log out of the way, and Ollie shot downstream with a cheerful splash.
“Thanks, Tilly!” Ollie called over his shoulder. “See you at the finish line—if you can catch up!”
Tilly huffed playfully and leapt back into the trees, racing ahead.

Meanwhile, Finn the fox dashed through the undergrowth, his paws light and swift. “This race is mine,” he thought, grinning. “Nothing’s faster than a fox!”
But as he zipped through a patch of brambles, his tail got caught in the thorny vines.
“Ow! Not my tail!” Finn yelped, tugging and twisting, but the brambles held him fast. He was stuck!
Just then, Ollie paddled by along the riverbank. He saw Finn struggling with the thorns and couldn’t help but laugh. “Need some help, buddy?” Ollie teased.
“Don’t just float there—help me out!” Finn groaned.
With a few quick bites, Ollie nibbled through the vines, setting Finn’s tail free.
“Thanks, Ollie,” Finn said, shaking out his tail. “Now let’s see who gets to the top first!” And with that, Finn shot off through the forest, leaving Ollie splashing in the stream behind him.

All three friends raced toward the base of Mossy Hill, arriving at nearly the same time. They were neck-and-neck, with the finish line just a climb away.
Finn panted, glancing up at the steep hill. “This is it! The flower crown is mine!”
Ollie groaned. “Climbing isn’t exactly my thing...”
Tilly grinned and bounded toward the nearest tree. “See you at the top, slowpokes!”
She scampered up the branches, hopping from tree to tree toward the summit. Finn and Ollie exchanged a look—there was no way they’d beat Tilly without some teamwork.
“Hop on!” Ollie said, crouching down. “I’ll give you a boost!”
Finn hesitated, then nodded. He leapt onto Ollie’s back, and the otter scrambled up the rocks as fast as he could, Finn gripping the branches above to pull them both higher.
Tilly was almost at the top when she heard the two friends catching up. “What?” she gasped, her tail flicking in surprise. “How are they so fast?”
With one last effort, Finn and Ollie reached the summit together, just as Tilly landed beside them.
All three friends tumbled onto the grassy hilltop, laughing breathlessly.
“I can’t believe we tied!” Tilly giggled.
“Yeah,” Ollie agreed, “but that was way more fun than racing alone.”
Finn grinned, his tail wagging. “Looks like Winston was right—we needed each other after all.”

Just then, Winston the owl fluttered down, a crown of wildflowers balanced on his head. “Congratulations!” he hooted. “I told you the race wasn’t just about speed—it was about friendship.”
The three friends smiled at one another, realizing that the real prize wasn’t the flower crown—it was the adventure they’d shared.
Winston plucked a few wildflowers from the crown and gave one to each of them. “A little prize for all of you,” he said with a wink. “After all, the best races are the ones you run together.”
With flowers tucked behind their ears and hearts full of joy, Ollie, Finn, and Tilly sat on the hilltop, watching the sunset paint the forest in shades of gold.
And from that day on, whenever the Great Forest Race rolled around, the three friends always raced together—because some adventures are better when shared.

The End."
